{
  "file": "synthetic.docx",
  "annotator": "Synthetic smoke fixture",
  "isClean": false,
  "notes": "Only the deterministic AS-1 issue is intentionally present. Mock verdicts are not expert quality labels.",
  "criteria": [
    {
      "criterionId": "T-1",
      "verdict": "ok"
    },
    {
      "criterionId": "T-2",
      "verdict": "ok"
    },
    {
      "criterionId": "T-3",
      "verdict": "ok"
    },
    {
      "criterionId": "T-4",
      "verdict": "ok"
    },
    {
      "criterionId": "T-5",
      "verdict": "ok"
    },
    {
      "criterionId": "T-6",
      "verdict": "ok"
    },
    {
      "criterionId": "T-7",
      "verdict": "ok"
    },
    {
      "criterionId": "T-8",
      "verdict": "ok"
    },
    {
      "criterionId": "T-9",
      "verdict": "ok"
    },
    {
      "criterionId": "LO-1",
      "verdict": "ok"
    },
    {
      "criterionId": "LO-2",
      "verdict": "ok"
    },
    {
      "criterionId": "LO-3",
      "verdict": "ok"
    },
    {
      "criterionId": "LO-4",
      "verdict": "ok"
    },
    {
      "criterionId": "LO-5",
      "verdict": "ok"
    },
    {
      "criterionId": "LO-6",
      "verdict": "ok"
    },
    {
      "criterionId": "LO-7",
      "verdict": "ok"
    },
    {
      "criterionId": "AS-1",
      "verdict": "issue",
      "severity": "critical",
      "evidence": [
        "Case project: 40%.",
        "Final exam: 50%."
      ],
      "evidenceBlockIds": [
        "b0011",
        "b0012"
      ],
      "acceptableFix": "Ask the instructor which assessment weight should change."
    },
    {
      "criterionId": "AS-2",
      "verdict": "ok"
    },
    {
      "criterionId": "AS-3",
      "verdict": "ok"
    },
    {
      "criterionId": "AS-4",
      "verdict": "ok"
    },
    {
      "criterionId": "AS-5",
      "verdict": "ok"
    },
    {
      "criterionId": "AS-6",
      "verdict": "ok"
    },
    {
      "criterionId": "AS-7",
      "verdict": "ok"
    },
    {
      "criterionId": "AS-8",
      "verdict": "ok"
    },
    {
      "criterionId": "PR-1",
      "verdict": "ok"
    },
    {
      "criterionId": "PR-2",
      "verdict": "ok"
    },
    {
      "criterionId": "PR-3",
      "verdict": "ok"
    },
    {
      "criterionId": "PR-4",
      "verdict": "ok"
    },
    {
      "criterionId": "PR-5",
      "verdict": "ok"
    },
    {
      "criterionId": "PO-1",
      "verdict": "ok"
    },
    {
      "criterionId": "PO-2",
      "verdict": "ok"
    },
    {
      "criterionId": "PO-3",
      "verdict": "ok"
    },
    {
      "criterionId": "PO-4",
      "verdict": "ok"
    },
    {
      "criterionId": "PO-5",
      "verdict": "ok"
    }
  ]
}
